,Country,Land,BMZ Nummer,Projektführendes Referat,Vorhabenbezeichnung,Inhaltliche Erläuterung,Haushaltstitel,Projektbeginn,Geplantes Projektende,Auftragsbetrag gesamt BMZ-Mittel,Auszahlungsbetrag gesamt,Geplante Beauftragungen 2023,Ländernamen
38,TGO,Togo,2014.0968.9,123,Ernährungssicherung und Resilienzstärkung,"Das Vorhaben hat zur Erfüllung von SDG 2 beigetragen und war zentral für die SEWOH-Aktivitäten im Aktionsfeld Ernährungssicherung. Der Fokus des Vorhabens lag auf Frauen im gebärfähigen Alter, Schwangere,  stillende Mütter und Kleinkinder.  Es läuft seit 2014, ist aktuell in 10 Ländern aktiv und hat bislang über 8 Mio. Menschen erreicht. Ab 2023 sind für das GV keine frischen Mittel mehr vorgesehen. Statt dessen Start des neuen GV Transformation der Ernährungssysteme mit entsprechend neuer strategischer Ausrichtung (s. Zeile 7).  ","Kap. 2310 Tit. 896 31
(SI Transformation der Agrar‐ und Ernährungssysteme)",2014-10-24 00:00:00.000,2026-09-30 00:00:00,271792593.0,209167629.0,1000000.0,"Cambodia, Madagascar, Benin, Mali, Burkina Faso, Ethiopia, Kenya, Zambia, Malawi, India, Togo, Yemen"
46,TZA,Tanzania,2021.2211.7,411,Bekämpfung Illegaler Finanzströme (IFF),"Das GV stärkt globale, regionale und nationale Systeme zur entwicklungsorientierten Bekämpfung illegaler Finanzströme. Thematische Schwerpunkte sind Prävention, Finanzermittlung und Vermögensrückführung. Die regionalen Schwerpunkte sind Afrika, Lateinamerika und der Westbalkan, mit jeweils eigenen Regionalbüros. NOR kofinanziert das Vorhaben mit 5,85 Mio. EUR.","Kap. 2301 Tit. 896 03 
(TZ)",2021-10-01 09:59:59.999,2024-09-30 00:00:00,15000000.0,6683731.33,0.0,"Senegal, Ghana, Bosnia and Herzegovina, Uganda, Peru, North Macedonia, Albania, Tunisia, Kenya, Kosovo, Tanzania, United Republic of, Serbia"
51,IND,Indien,2021.2214.1,414,Cities Finance Facility (CFF),"Die Cities Finance Facility (CFF) berät Städte bei der Vorbereitung und Finanzierung von sozial inklusiven Stadtentwicklungsprojekten, die zu Minderung und Anpassung an den Klimawandel beitragen (Leitungsschwerpunkt Just Transition). Die CFF als Multigeberpartnerschaft wird durch eine Kombi-Finanzierung mit dem britischen Ministerium Department for Business, Energy and Industrial Strategy (BEIS) sowie durch die französische Agence Francaise du Development aufgestockt, USAid plant ebenfalls einen Beitrag ab 2023. Die Aufstockung durch Kombi-Finanzierungen weiterer Geber ermöglicht der CFF, ihre Projekte zu skalieren und politische Sichtbarkeit durch eine Geberallianz zu stärken.","Kap. 2301 Tit. 896 03 
(TZ)",2021-04-01 00:00:00.000,2024-10-31 00:00:00,7250000.0,5856059.52,0.0,"Senegal, Indonesia, Brazil, Ghana, Peru, Ecuador, Sierra Leone, South Africa, Malaysia, Colombia, India, Philippines"
57,TZA,Tanzania,2014.2275.7,423,Globales Programm Energising Development,"Ziel der 2005 von den Niederlanden (DGIS) und Deutschland (BMZ) etablierten Partnerschaft „Energising Development"" (EnDev) ist es, bis 2025 mindestens 26,6 Mio. Menschen bedarfsgerechte, klimafreundlichen Energieversorgung zu ermöglichen. ","Kap. 2301 Tit. 896 03 
(TZ)",2014-06-25 00:00:00.000,2025-12-31 00:00:00,109477421.0,86770895.52,0.0,"Burundi, Liberia, Bangladesh, Ethiopia, Sierra Leone, Nepal, Cambodia, Benin, Uganda, Guinea, Tanzania, United Republic of, Niger, Bolivia, Plurinational State of, Congo, The Democratic Republic of the, ""Lao Peoples Democratic Republic"", Kenya, Malawi, Mozambique, Mali, Senegal, Madagascar, Rwanda"
58,SWZ,Eswatini,2018.2010.9,423,Programm Globale Energiewende (GET.pro),"Im Rahmen eines koordinierten europäischen Ansatzes sollen die Voraussetzungen für Investitionen in eine globale Energiewende verbessert werden. Das Programm Globale Energiewende (GET.pro) ist global tätig, der Fokus liegt auf Afrika.","Kap. 2301 Tit. 896 03 
(TZ)",2018-02-12 00:00:00.000,2026-09-30 00:00:00,49425000.0,15953300.9,0.0,"Cameroon, Burundi, Rwanda, Peru, Uganda, Burkina Faso, Ethiopia, Kenya, South Africa, Mozambique, Eswatini, Nigeria"
59,MOZ,Mozambik,2018.2176.8,423,Grüne Bürgerenergie,"Die Voraussetzungen zur Versorgung ländlicher Regionen in ausgewählten Ländern Afrikas mit dezentralen, erneuerbaren Energien sollen unter Beteiligung von Bürgern und Unternehmen verbessert werden.","Kap. 2301 Tit. 896 03 
(TZ)",2018-12-11 00:00:00.000,2023-09-30 00:00:00,63400000.0,49189708.31,0.0,"Senegal, Cameroon, Ghana, Benin, Egypt, Uganda, Namibia, Ethiopia, Kenya, ""Côte dIvoire"", Mozambique, Tanzania, United Republic of, Zambia, Mali, Congo, The Democratic Republic of the"
60,PHL,Philippinen,2021.2031.9,423,Globalvorhaben CONNEX Support Unit II,"Die Multigeberfinanzierte CONNEX Support Unit soll Schwellenländer darin unterstützen, den entwicklungspolitischen Nutzen von Investitionen zu erhöhen.","Kap. 2301 Tit. 896 03 
(TZ)",2021-03-01 11:00:00.000,2024-02-29 11:00:00,7000000.0,3669121.03,0.0,"Senegal, Argentina, Liberia, Rwanda, Mongolia, Mauritania, Afghanistan, Ecuador, Montserrat, Panama, Philippines"
61,KEN,Kenia,2017.2048.1,424,Beratungs- und Investitionsfonds zum Ozonschutz (Ozon-Fonds),"Das Vorhaben dient der Bundesregierung zur Finanzierung und Gestaltung bilateraler Kooperationsmaßnahmen mit „Artikel-5-Ländern“ (= Entwicklungsländer, EL) des Montrealer Protokolls (MP) zur nachhaltigen Umsetzung ihrer Verpflichtungen aus diesem Multilateralen Umweltabkommen. 
Dazu werden insbesondere Nutzer von ozonzerstörenden und klimaschädlichen Substanzen (ODS) dabei unterstützt, ihre Produkte klimaverträglich, und zukunftsfähig zu gestalten, ihre Energie-Effizienz zu verbessern und ihre Wartung sicherzustellen. ","Kap. 2301 Tit. 896 03 
(TZ)",2017-06-09 00:00:00.000,2026-12-31 00:00:00,17899000.0,12126561.58,0.0,"Seychelles, Brazil, Papua New Guinea, Mexico, Egypt, Liberia, Iran, Islamic Republic of, Namibia, Burkina Faso, Mauritius, Kenya, China, Colombia, India, Lesotho, Zimbabwe"
67,PAK,Pakistan,"2019.2146.9,
2023.2163.6",500,Programm Migration und Diaspora,"Förderung positiver Effeke von Migration durch Migrationsberatung, Rückkehrende Fachkräfte, Diasporaförderung, Migrationspolitikberatung; soll ab 1.06. 2023 in ein Folgevorhaben übergehen ""Migration entwicklungspolitisch gestalten mit folgendem Inhalt: Migrationspolitikberatung und Aufbau von Kapazitäten von Partnerstrukturen, insbes. im Bereich Feministische Entwicklungspolitik (Globale Sorgeketten, prekäre Arbeit) und Diasporaförderung, Partnerschaften mit mulilateralen Akteuren.  ","Kap. 2301 Tit. 896 03 
(TZ)",2019-05-12 00:00:00.000,2023-06-30 00:00:00,94950000.0,78750430.57,24000000.0,"Cameroon, Ukraine, Egypt, Afghanistan, Palestine, State of, Ecuador, Ethiopia, Nepal, Albania, Tunisia, Pakistan, Iraq, Viet Nam, Serbia, Indonesia, Ghana, Gambia, Georgia, Jordan, Kenya, India, Morocco, Senegal, Peru, Kosovo, Colombia, Nigeria"
69,GHA,Ghana,2019.2148.5,500,Fachkräftefonds Migration und Diaspora,"Finanzierung Rückkehrender Fachkräfte, Integrierte Fachkräfte als Teil des Vorhabens Migration und Diaspora","Kap. 2301 Tit. 896 03 
(TZ)",2019-03-21 00:00:00.000,2025-03-31 00:00:00,37000000.0,29403627.76,0.0,"Cameroon, Ukraine, Palestine, State of, Ecuador, Ethiopia, Nepal, Tunisia, Viet Nam, Serbia, Indonesia, Ghana, Georgia, Jordan, Kenya, India, Nigeria, Morocco, Senegal, Peru, Kosovo, Colombia, Albania"
74,NAM,Namibia,"2019.2151.9,
2022.2235.4",513,Bund-Länder-Pilotprogramm: Neue Formate der Zusammenarbeit in der TZ,"Die Bundesländer verfügen über Expertise und praktische Erfahrung in der Umsetzung von Politikfeldern, die für die Beratung und die Zusammenarbeit mit Partnerländern einen hohen Mehrwert generieren können. Ziel des Vorhabens: In Kooperationsprojekten der deutschen TZ werden die Kompetenzen der BL genutzt.  ","Kap. 2301 Tit. 896 03 
(TZ)",2019-09-09 00:00:00.000,2023-06-30 00:00:00,14140000.0,11133196.08,8500000.0,"Germany, Ethiopia, Tunisia, Iraq, Viet Nam, Uganda, North Macedonia, Tanzania, United Republic of, Serbia, Ghana, Namibia, Malawi, Mozambique, India, Togo, Nigeria, Bosnia and Herzegovina, Rwanda, Peru, Kosovo, South Africa, Albania"
76,JOR,Jordanien,2021.2210.9,513,Fachkräftefonds für kommunale Partnerschaften weltweit,"Das Vorhaben unterstützt kommunale Partnerschaften 
als Fondsmaßnahme. Antragsberechtigt sind alle bestehenden
kommunalen Partnerschaften zwischen einer deutschen Kommune/
Kommunalverband und einer Partnerkommune/ Partnerkommunalverband
in einem Partnerland gemäß der OECD/DAC-Liste1.","Kap. 2301 Tit. 896 03 
(TZ)",2022-01-01 11:00:00.000,2026-12-31 00:00:00,10300000.0,2422923.27,0.0,"Ukraine, Palestine, State of, Ecuador, Sierra Leone, Zimbabwe, North Macedonia, Guinea, Tanzania, United Republic of, Indonesia, Georgia, Jordan, Zambia, Mozambique, Lebanon, Rwanda, Peru, Kosovo, South Africa"
1,KGZ,Kyrgyzstan,2020.2155.8,100,Backup Gesundheit,"Das Multi-Geber-Vorhaben GV BACKUP Gesundheit berät Partner bei der effizienten Umsetzung von globalen Gesundheitsfinanzierungen und beim Aufbau leistungsstarker nationaler Gesundheits- und Krankenversicherungssysteme. Ein Schwerpunkt liegt u.a. in der Beratung der Partner, multilaterale Mittel im Sinne der Leitungsprioritäten systemstärkend (und nicht nur leicht absorbierbar zB für Medikamente) einzusetzen. Darüber hinaus verbessert das Vorhaben die Rahmenbedingungen für lokale Impfstoffproduktion in Afrika.","Kap. 2301 Tit. 896 03 
(TZ)",2020-01-13 00:00:00.000,2026-03-31 00:00:00,36747358.3,24271959.8,6215000.0,"Cameroon, Ukraine, Liberia, Uzbekistan, Ethiopia, Sierra Leone, Nepal, Zimbabwe, Chad, Cambodia, Kazakhstan, Kyrgyzstan, Uganda, Tanzania, United Republic of, Niger, Myanmar, Congo, The Democratic Republic of the, Ghana, Malawi, Zambia, Mozambique, Togo, Turkmenistan, Rwanda, Burkina Faso, Tajikistan, South Africa, Nigeria"
2,AGO,Angola,2020.2256.4,101,Unterstützung der internationalen Allianz zur Reduzierung von Gesundheitsrisiken im Wildtierhandel,"Eine internationale Allianz wird als interdisziplinäre, inklusive Austausch-Plattform etabliert, um wissenschaftliche Evidenz in die Praxis und konkrete Policy-Empfehlungen zu übersetzen. So verbreitet sie erfolgreich Ansätze zur Reduzierung von Risiken der Umwelt-, Human- und Tiergesundheit im Umgang mit Wildtieren und Wildtierprodukten entlang der gesamten Handelskette.","Kap. 2301 Tit. 896 03 
(TZ)",2020-12-15 00:00:00.000,2024-12-31 00:00:00,8500000.0,2703186.25,3215000.0,"Cameroon, Brazil, Guatemala, Thailand, Viet Nam, Bolivia, Plurinational State of, Bhutan, Philippines, Congo, The Democratic Republic of the, Indonesia, ""Lao Peoples Democratic Republic"", Angola, Mongolia, China, Kenya, Zambia, India, Botswana, Nigeria"
3,KEN,Kenia,2020.2267.1,101,"GV Pandemieprävention und -bekämpfung, One Health","Das Vorhaben erarbeitet überregional und in sechs Länder-/Regionalleistungspaketen wirksame Maßnahmen der Vorbeugung und Bekämpfung von Epidemien und Pandemien. Das Ziel wird durch eine verbesserte Zusammenarbeit und Kapazitätsstärkung auf internationaler, regionaler und Länderebene erreicht. Die Umsetzung erfolgt u.a. durch die Stärkung von Institutionen und Organisationen im Bereich von Human-, Tiergesundheit und Umwelt unter Nutzung des One Health Ansatzes. Die Schnell Einsetzbare Expertengruppe Gesundheit (SEEG) unterstützt im Kooperationsverbund mit RKI, BNITM, Friedrich-Loeffler Institut und Charité Partner vor Ort bei der Vorbereitung und Reaktion auf Infektionsausbrüche.","Kap. 2301 Tit. 896 03 
(TZ)",2020-11-10 00:00:00.000,2024-08-31 00:00:00,48750000.0,27198748.4,3940000.0,"Cameroon, Guatemala, Cambodia, Burundi, Mexico, Belize, Viet Nam, Rwanda, South Sudan, Ecuador, Uganda, Kenya, Tanzania, United Republic of"
6,IND,Indien,"2020.2163.2,
2023.2202.2",103,"Globalvorhaben Innovation und Lernen in der sozialen Sicherung - neuer Titel (Folgephase 2023): ""Globale Allianzen für soziale Sicherung""","Das Globalvorhaben unterstützt in ausgewählten Partnerländern pilothaft innovative Kooperationsansätze mit Weltbank, ILO und anderen internationalen Partnern (Unterstützung/Anschubfinanzierung von ersten Länderaktivitäten im Rahmen der Umsetzung der VN Initiative des Global Accelerators und TZ-Maßnahmen zur Flankierung von multilateralen Investitionen der WB durch GIZ). Zudem fördert das Vorhaben die Entwicklung und Nutzung von digitalen Lösungen für den Aufbau von leistungsfähigen und transparenten sozialen Sicherungs- und Gesundheitssystemen (""openIMIS-Initiative in Kooperation mit DEZA, WB, ILO und UNICEF). 
Fortführung ab 9/2023 geplant.","Kap. 2301 Tit. 896 03 
(TZ)",2020-06-19 00:00:00.000,2023-08-31 00:00:00,26300000.0,17518053.63,10500000.0,"Indonesia, Chad, Mexico, Gambia, Bangladesh, Mauritania, Burkina Faso, Nepal, South Africa, Malawi, Tanzania, United Republic of, India, Niger, Congo, The Democratic Republic of the"
18,MWI,Malawi,2018.2085.1,122,Fonds zur Förderung der personellen Zusammenarbeit mit Partnern der internationalen Agrarforschung - PIAF,"Vorhaben zum strategischen Aufbau von Kapazitäten in internationalen Agrarforschungsein-richtungen der Globalen Forschungspartnerschaft für eine ernährungssichere Zukunft (CGIAR) durch Entsendung von CIM Integrierten Fachkräften. Dies trägt dazu bei, dass Forschungsergebnisse in entwicklungsrelevante Fortschritte für Kleinbäuer*innn umgewandelt werden können.","Kap. 2301 Tit. 896 03 
(TZ)",2018-12-10 00:00:00.000,2024-09-30 00:00:00,10600000.0,7612686.52,0.0,"Egypt, Ethiopia, Thailand, Viet Nam, Uganda, Tanzania, United Republic of, Honduras, Philippines, Indonesia, Ghana, Kenya, Malawi, India, Morocco, Mexico, Peru, Colombia, Sri Lanka, Nigeria"
21,ZMB,Sambia,2014.0967.1,122,Grüne Innovationszentren in der Agrar- und Ernährungswirtschaft,"Durch umfangreiche WSK-Förderung werden kleinbäuerliche Betriebe sowie vor- und nachgelagerte Unternehmen befähigt, einkommens-, beschäftigungs-, produktivitätssteigernde und klima-intelligente Innovationen einzusetzen. Das Vorhaben verfolgt einen institutionenbildenden Ansatz als Hebel zur nachhaltigen Verbreitung angepasster Innovationen. Dabei kommt dem Auf- und Ausbau von Kompetenzen zur breitenwirksamen Nutzung der Innovationen eine Kernfunktion zu. Die Innovationszentren stützen sich hierzu auf eine Zusammenarbeit mit über 150 Kooperationspartnern weltweit. Derzeit noch in 13 afrikanischen Ländern sowie Indien und Vietnam aktiv.","Kap. 2310 Tit. 896 31
(SI Transformation der Agrar‐ und Ernährungssysteme)",2014-10-01 00:00:00.000,2026-03-01 00:00:00,541904331.0,462841738.72,2500000.0,"Cameroon, Ghana, Benin, Viet Nam, Burkina Faso, Ethiopia, Tunisia, Kenya, ""Côte dIvoire"", Mozambique, Malawi, Zambia, India, Togo, Mali, Nigeria"
26,ZMB,Sambia,2018.0121.6,122,Skalierung von digitalen Agrarinnovationen,"Es zielt darauf ab, erprobte digitale Innovationen für den Agrar- und Ernährungsbereich in aus-gewählten Märkten Afrikas einkommenswirksam zu verbreiten. Dazu werden Start-ups in ver-schiedenen Ländern Afrikas identifiziert, welche digitale Innovationen für den Agrar- und Ernäh-rungssektor anbieten („Agrarinnovationen“), aber noch keine Skalierung erreicht haben. Die aus-gewählten Start-ups werden beim organisatorischen, finanziellen und technologischen Kapazi-tätsaufbau unterstützt und so für Partner und Investoren attraktiv gemacht.","Kap. 2310 Tit. 896 31
(SI Transformation der Agrar‐ und Ernährungssysteme)",2019-01-01 00:00:00.000,2027-04-30 00:00:00,23000000.0,6405619.24,,"Cameroon, Egypt, Liberia, Tunisia, Benin, Uganda, Tanzania, United Republic of, Congo, The Democratic Republic of the, Ghana, Kenya, Malawi, Zambia, Togo, Morocco, Senegal, Madagascar, Rwanda, Burkina Faso, ""Côte dIvoire"", South Africa, Algeria, Nigeria"
38,YEM,Jemen,2014.0968.9,123,Ernährungssicherung und Resilienzstärkung,"Das Vorhaben hat zur Erfüllung von SDG 2 beigetragen und war zentral für die SEWOH-Aktivitäten im Aktionsfeld Ernährungssicherung. Der Fokus des Vorhabens lag auf Frauen im gebärfähigen Alter, Schwangere,  stillende Mütter und Kleinkinder.  Es läuft seit 2014, ist aktuell in 10 Ländern aktiv und hat bislang über 8 Mio. Menschen erreicht. Ab 2023 sind für das GV keine frischen Mittel mehr vorgesehen. Statt dessen Start des neuen GV Transformation der Ernährungssysteme mit entsprechend neuer strategischer Ausrichtung (s. Zeile 7).  ","Kap. 2310 Tit. 896 31
(SI Transformation der Agrar‐ und Ernährungssysteme)",2014-10-24 00:00:00.000,2026-09-30 00:00:00,271792593.0,209167629.0,1000000.0,"Cambodia, Madagascar, Benin, Mali, Burkina Faso, Ethiopia, Kenya, Zambia, Malawi, India, Togo, Yemen"
46,SRB,Serbien,2021.2211.7,411,Bekämpfung Illegaler Finanzströme (IFF),"Das GV stärkt globale, regionale und nationale Systeme zur entwicklungsorientierten Bekämpfung illegaler Finanzströme. Thematische Schwerpunkte sind Prävention, Finanzermittlung und Vermögensrückführung. Die regionalen Schwerpunkte sind Afrika, Lateinamerika und der Westbalkan, mit jeweils eigenen Regionalbüros. NOR kofinanziert das Vorhaben mit 5,85 Mio. EUR.","Kap. 2301 Tit. 896 03 
(TZ)",2021-10-01 09:59:59.999,2024-09-30 00:00:00,15000000.0,6683731.33,0.0,"Senegal, Ghana, Bosnia and Herzegovina, Uganda, Peru, North Macedonia, Albania, Tunisia, Kenya, Kosovo, Tanzania, United Republic of, Serbia"
51,PHL,Philippinen,2021.2214.1,414,Cities Finance Facility (CFF),"Die Cities Finance Facility (CFF) berät Städte bei der Vorbereitung und Finanzierung von sozial inklusiven Stadtentwicklungsprojekten, die zu Minderung und Anpassung an den Klimawandel beitragen (Leitungsschwerpunkt Just Transition). Die CFF als Multigeberpartnerschaft wird durch eine Kombi-Finanzierung mit dem britischen Ministerium Department for Business, Energy and Industrial Strategy (BEIS) sowie durch die französische Agence Francaise du Development aufgestockt, USAid plant ebenfalls einen Beitrag ab 2023. Die Aufstockung durch Kombi-Finanzierungen weiterer Geber ermöglicht der CFF, ihre Projekte zu skalieren und politische Sichtbarkeit durch eine Geberallianz zu stärken.","Kap. 2301 Tit. 896 03 
(TZ)",2021-04-01 00:00:00.000,2024-10-31 00:00:00,7250000.0,5856059.52,0.0,"Senegal, Indonesia, Brazil, Ghana, Peru, Ecuador, Sierra Leone, South Africa, Malaysia, Colombia, India, Philippines"
57,NER,Niger,2014.2275.7,423,Globales Programm Energising Development,"Ziel der 2005 von den Niederlanden (DGIS) und Deutschland (BMZ) etablierten Partnerschaft „Energising Development"" (EnDev) ist es, bis 2025 mindestens 26,6 Mio. Menschen bedarfsgerechte, klimafreundlichen Energieversorgung zu ermöglichen. ","Kap. 2301 Tit. 896 03 
(TZ)",2014-06-25 00:00:00.000,2025-12-31 00:00:00,109477421.0,86770895.52,0.0,"Burundi, Liberia, Bangladesh, Ethiopia, Sierra Leone, Nepal, Cambodia, Benin, Uganda, Guinea, Tanzania, United Republic of, Niger, Bolivia, Plurinational State of, Congo, The Democratic Republic of the, ""Lao Peoples Democratic Republic"", Kenya, Malawi, Mozambique, Mali, Senegal, Madagascar, Rwanda"
58,NGA,Nigeria,2018.2010.9,423,Programm Globale Energiewende (GET.pro),"Im Rahmen eines koordinierten europäischen Ansatzes sollen die Voraussetzungen für Investitionen in eine globale Energiewende verbessert werden. Das Programm Globale Energiewende (GET.pro) ist global tätig, der Fokus liegt auf Afrika.","Kap. 2301 Tit. 896 03 
(TZ)",2018-02-12 00:00:00.000,2026-09-30 00:00:00,49425000.0,15953300.9,0.0,"Cameroon, Burundi, Rwanda, Peru, Uganda, Burkina Faso, Ethiopia, Kenya, South Africa, Mozambique, Eswatini, Nigeria"
59,TZA,Tanzania,2018.2176.8,423,Grüne Bürgerenergie,"Die Voraussetzungen zur Versorgung ländlicher Regionen in ausgewählten Ländern Afrikas mit dezentralen, erneuerbaren Energien sollen unter Beteiligung von Bürgern und Unternehmen verbessert werden.","Kap. 2301 Tit. 896 03 
(TZ)",2018-12-11 00:00:00.000,2023-09-30 00:00:00,63400000.0,49189708.31,0.0,"Senegal, Cameroon, Ghana, Benin, Egypt, Uganda, Namibia, Ethiopia, Kenya, ""Côte dIvoire"", Mozambique, Tanzania, United Republic of, Zambia, Mali, Congo, The Democratic Republic of the"
61,CHN,China,2017.2048.1,424,Beratungs- und Investitionsfonds zum Ozonschutz (Ozon-Fonds),"Das Vorhaben dient der Bundesregierung zur Finanzierung und Gestaltung bilateraler Kooperationsmaßnahmen mit „Artikel-5-Ländern“ (= Entwicklungsländer, EL) des Montrealer Protokolls (MP) zur nachhaltigen Umsetzung ihrer Verpflichtungen aus diesem Multilateralen Umweltabkommen. 
Dazu werden insbesondere Nutzer von ozonzerstörenden und klimaschädlichen Substanzen (ODS) dabei unterstützt, ihre Produkte klimaverträglich, und zukunftsfähig zu gestalten, ihre Energie-Effizienz zu verbessern und ihre Wartung sicherzustellen. ","Kap. 2301 Tit. 896 03 
(TZ)",2017-06-09 00:00:00.000,2026-12-31 00:00:00,17899000.0,12126561.58,0.0,"Seychelles, Brazil, Papua New Guinea, Mexico, Egypt, Liberia, Iran, Islamic Republic of, Namibia, Burkina Faso, Mauritius, Kenya, China, Colombia, India, Lesotho, Zimbabwe"
67,IRQ,Irak,"2019.2146.9,
2023.2163.6",500,Programm Migration und Diaspora,"Förderung positiver Effeke von Migration durch Migrationsberatung, Rückkehrende Fachkräfte, Diasporaförderung, Migrationspolitikberatung; soll ab 1.06. 2023 in ein Folgevorhaben übergehen ""Migration entwicklungspolitisch gestalten mit folgendem Inhalt: Migrationspolitikberatung und Aufbau von Kapazitäten von Partnerstrukturen, insbes. im Bereich Feministische Entwicklungspolitik (Globale Sorgeketten, prekäre Arbeit) und Diasporaförderung, Partnerschaften mit mulilateralen Akteuren.  ","Kap. 2301 Tit. 896 03 
(TZ)",2019-05-12 00:00:00.000,2023-06-30 00:00:00,94950000.0,78750430.57,24000000.0,"Cameroon, Ukraine, Egypt, Afghanistan, Palestine, State of, Ecuador, Ethiopia, Nepal, Albania, Tunisia, Pakistan, Iraq, Viet Nam, Serbia, Indonesia, Ghana, Gambia, Georgia, Jordan, Kenya, India, Morocco, Senegal, Peru, Kosovo, Colombia, Nigeria"
69,GEO,Georgien,2019.2148.5,500,Fachkräftefonds Migration und Diaspora,"Finanzierung Rückkehrender Fachkräfte, Integrierte Fachkräfte als Teil des Vorhabens Migration und Diaspora","Kap. 2301 Tit. 896 03 
(TZ)",2019-03-21 00:00:00.000,2025-03-31 00:00:00,37000000.0,29403627.76,0.0,"Cameroon, Ukraine, Palestine, State of, Ecuador, Ethiopia, Nepal, Tunisia, Viet Nam, Serbia, Indonesia, Ghana, Georgia, Jordan, Kenya, India, Nigeria, Morocco, Senegal, Peru, Kosovo, Colombia, Albania"
74,MWI,Malawi,"2019.2151.9,
2022.2235.4",513,Bund-Länder-Pilotprogramm: Neue Formate der Zusammenarbeit in der TZ,"Die Bundesländer verfügen über Expertise und praktische Erfahrung in der Umsetzung von Politikfeldern, die für die Beratung und die Zusammenarbeit mit Partnerländern einen hohen Mehrwert generieren können. Ziel des Vorhabens: In Kooperationsprojekten der deutschen TZ werden die Kompetenzen der BL genutzt.  ","Kap. 2301 Tit. 896 03 
(TZ)",2019-09-09 00:00:00.000,2023-06-30 00:00:00,14140000.0,11133196.08,8500000.0,"Germany, Ethiopia, Tunisia, Iraq, Viet Nam, Uganda, North Macedonia, Tanzania, United Republic of, Serbia, Ghana, Namibia, Malawi, Mozambique, India, Togo, Nigeria, Bosnia and Herzegovina, Rwanda, Peru, Kosovo, South Africa, Albania"
76,ZMB,Sambia,2021.2210.9,513,Fachkräftefonds für kommunale Partnerschaften weltweit,"Das Vorhaben unterstützt kommunale Partnerschaften 
als Fondsmaßnahme. Antragsberechtigt sind alle bestehenden
kommunalen Partnerschaften zwischen einer deutschen Kommune/
Kommunalverband und einer Partnerkommune/ Partnerkommunalverband
in einem Partnerland gemäß der OECD/DAC-Liste1.","Kap. 2301 Tit. 896 03 
(TZ)",2022-01-01 11:00:00.000,2026-12-31 00:00:00,10300000.0,2422923.27,0.0,"Ukraine, Palestine, State of, Ecuador, Sierra Leone, Zimbabwe, North Macedonia, Guinea, Tanzania, United Republic of, Indonesia, Georgia, Jordan, Zambia, Mozambique, Lebanon, Rwanda, Peru, Kosovo, South Africa"
1,UGA,Uganda,2020.2155.8,100,Backup Gesundheit,"Das Multi-Geber-Vorhaben GV BACKUP Gesundheit berät Partner bei der effizienten Umsetzung von globalen Gesundheitsfinanzierungen und beim Aufbau leistungsstarker nationaler Gesundheits- und Krankenversicherungssysteme. Ein Schwerpunkt liegt u.a. in der Beratung der Partner, multilaterale Mittel im Sinne der Leitungsprioritäten systemstärkend (und nicht nur leicht absorbierbar zB für Medikamente) einzusetzen. Darüber hinaus verbessert das Vorhaben die Rahmenbedingungen für lokale Impfstoffproduktion in Afrika.","Kap. 2301 Tit. 896 03 
(TZ)",2020-01-13 00:00:00.000,2026-03-31 00:00:00,36747358.3,24271959.8,6215000.0,"Cameroon, Ukraine, Liberia, Uzbekistan, Ethiopia, Sierra Leone, Nepal, Zimbabwe, Chad, Cambodia, Kazakhstan, Kyrgyzstan, Uganda, Tanzania, United Republic of, Niger, Myanmar, Congo, The Democratic Republic of the, Ghana, Malawi, Zambia, Mozambique, Togo, Turkmenistan, Rwanda, Burkina Faso, Tajikistan, South Africa, Nigeria"
2,MNG,Mongolei,2020.2256.4,101,Unterstützung der internationalen Allianz zur Reduzierung von Gesundheitsrisiken im Wildtierhandel,"Eine internationale Allianz wird als interdisziplinäre, inklusive Austausch-Plattform etabliert, um wissenschaftliche Evidenz in die Praxis und konkrete Policy-Empfehlungen zu übersetzen. So verbreitet sie erfolgreich Ansätze zur Reduzierung von Risiken der Umwelt-, Human- und Tiergesundheit im Umgang mit Wildtieren und Wildtierprodukten entlang der gesamten Handelskette.","Kap. 2301 Tit. 896 03 
(TZ)",2020-12-15 00:00:00.000,2024-12-31 00:00:00,8500000.0,2703186.25,3215000.0,"Cameroon, Brazil, Guatemala, Thailand, Viet Nam, Bolivia, Plurinational State of, Bhutan, Philippines, Congo, The Democratic Republic of the, Indonesia, ""Lao Peoples Democratic Republic"", Angola, Mongolia, China, Kenya, Zambia, India, Botswana, Nigeria"
